combined_ids,visual_vividness,hallucination_description
"3165, 3166, 3167, 3169, 3171, 3172, 3173, 3174, 3175, 3176, 3180, 3181, 3182, 3184, 3186, 3188, 3189, 3191, 3192, 3195, 3200, 3203, 3205, 3206, 3207, 3208, 3209, 3211, 3212, 3213, 3217, 3218, 3220, 3222, 3223, 3224, 3225, 3227, 3229, 3230, 3231, 3232, 3233, 3234, 3235, 3236, 3244, 3248, 3249, 3250, 3252, 3255, 3258, 3260, 3261, 3262, 3263, 3265, 3266, 3267, 3268, 3269, 3277, 3280, 3284, 3285, 3287, 3289, 3295, 3301, 3304, 3305, 3306, 3308, 3309, 3311, 3313, 3314, 3315, 3317, 3319, 3320, 3321, 3322, 3323, 3326, 3328, 3329, 3331, 3332, 3333, 3334, 3335, 3339, 3341, 3344, 3345, 3346, 3348, 3349",7,"patterns, cobwebs, roads, smoke, haze Patterns, flowers, fireworks, flowing light, webs, fractals, blue and green geometric shapes. Patterns, geometric shapes, tunnels, grids Patterns, mostly geometric shapes. At one point it looked like there were red, green, and yellow waves (like a visual of a sound wave) crashing around the screen Patterns, originating in center and corners of the screen.  Buildings, People, Astronomical objects, Eyes, Faces, Horizons/Landscapes, Conflict, Struggle, Survival. Patterns: at first reminded me of a bed of dry tree leaves, with distinct edges and veining, though it was only around the edges of the screen, not in the middle; then cloudy white and dark blue puffs that resembled leopard markings; then lines/dotted lines of light that mostly rotated counter-clockwise but moved around the screen vertically and horizontally.  Patters of lines what csme to mind was similar to cracks in glass morphing into a pattern of “cells” layered upon themselves then turning to into what i can only describe as a Jackson Pollock painting. All this occurring underneath the flashing colors of the screen, really cool and trippy. Peace sign, cross, shooting star, galaxy people standing, dancing (cocktail party atmosphere) People, a city, my cat, myself Periods where blue, then orange, colors dominated, lines appeared and disappeared Phoenix,Purple,Eyes pile of golden objects in the left upper portion of the screen, shifting to a centered rainbow circle with diagonal rays shooting out to the corners of the screen. and finally a bunch of small 1"" square ""windows"" looking through silhouettes of trees into a lake (this last was the less vivid imagery but still notable) Pink yellow and green lines moving past me like moving through a tunnel. Glimpses of mountains. Vague human body shapes. Moving blobs. Large vague shadows. Pinwheel type effect, a line rotating clockwise for a while, counterclockwise for a while Playing baseball, a man's face he seemed evil, a house on the edge of a town and someone laying down.  Please pointed stone arches passing one after the other poka dots on a dress or on a landscape with brownish purplish colour well defined Primarily a large X covering the whole screen with a slight vertical line primitive people around a campfire, spiders with big eyes, a country scene around autumn with bats with big eyes, a summer scene at the beach with dune foliage blowing in the wind, red and black, blue and green, stars. Prominent cross, blurry text, spheres, spiral pulling me in pulsating squares overlapping morphed into spiraling pulses that spun rapidly around and a long bird flapping its wings was in the center of my view and then I stopped because I was getting a headache pulsation that started turning into lines, spirals, balls and trajectories Pulses of morphing objects and colors of all variety pulses, like drops on water. spiral motion, first clockwise, then counter clockwise, spot with radial beams, sometime 4, 5 or 8 Pulsing hexagonal fractal, white sound waveform, a scratched film-grain texture, an amorphous shape sliding around the screen of a indescribable color.  pulsing red, dark blue, and yellow blobs; pale lines (grids, spiderwebs); propellers spinning this way and then that turning into wreaths of fish also spinning, then daisy flowers spinning; pale line drawings superimposed on each other and morphing, every possible thing and person from cups to hats to faces; saw nothing ""real"" or fully fleshed; color blobs underlaid it all, constantly; spinning wheels and propellers constant. pulsing shapes, middle cube morphed into golden line which moved around the screen, rotating the remaining of cube pulsing squares and zig zagging patterns going vertically and diagonally Pyramid of Giza not just a triangle. The sun and space. A tunnel and roads with curves. A hooded figure. Film. Random shapes. Pyramid. Cross in the center dividing the screen into 4 segments. bright blue and white center with lines coming out in the 4 directions. Then that would spin and change. The white center could then be a comet moving up and down then off the screen tho the left. lots of stuff moved to the left. Grid patterns. Arrows pointing right but moving left like >>>> but filled the whole screen. some building like structures but would fade quickly going back to geometric shapes. Some shapes and movement had a three dimensional effect. Quick spinning circles resembled fluid flow I saw the most. I saw flashing striped lines. I saw yellow and green and orange. Two different textures, one under the other, moving in different directions. Raging red flickers of fire. Like seeing shapes and creating stories looking at a camp fire. Rainbow Rainbow (noted above). Also lines. Not sure oh what. The rainbow was the most notable thing. Also a sense of pixels… like that I could see the pixels, in the display actually changing. Rainbow (noted above). Also lines. Not sure oh what. The rainbow was the most notable thing. Also a sense of pixels… like that I could see the pixels, in the display actually changing. rainbow circles going round, golden spiral, waves, repeating faces & bodies, a lighthouse, an island, a beach, beetle which took up the whole screen, hearts, chakras orbs, stars, going forward on train tracks in a train, tunnels, single eye, several eyes, simple geometric patterns, and complex patterns Rainbow lines rotating as if it were a yo yo being spun by the string rainbow lines, shapes, streets, outer space with stars, the planets, vivid green and blue,  Rainbow of colors and objects that were outlined in rainbow color Rainbow of colors, it seemed like the colors would change into shapes.  The flash seemed to slowdown and then speed up rainbow rays, distorted faces like Picasso's paints, roads, traveling alon the roads, some animal faces like gorilla and bear, rainbow fractals,. rainbow shapes and patterns, images of the earth and stars, and especially circularly rotating patterns of dots, all of which suggested shapes of galaxies, the earth and stars, and fish or birds flying about. Almost every shape or image I saw was in motion, hardly ever was it still Rainbow spirals and diagonal lines rainbow-colored whirlwind Random assortments of shapes, geometric shapes, faces, I swear to God at one point I saw very vividly the window that's behind me and the tree in my yard, moving silhouettes of people that would turn and move as if in a old movie where you can see each frame of the movie change to the next, one was a silhouette of what looked like a man in a noir style detective outfit with his trench coat and silhouettes of leaves blowing in the wind from the fan in my room. He was looking down and turned to face towards me before turning the other way and fading away into the next image, I think at one point there was a fine china mug that I saw Random geometric and abstract shapes of yellow zooming around and joining frequently in rotating circles and funnels. Many times I could manipulate the direction of the rotation. Saw pulsing lights. Might have been dark blue.  Random geometric shapes random items - tools, containers random lines and tunnels  Random massive blocks of rotating geometry, kind of like a honeycomb cells that made me feel ill at first. But I couldn't really make anything out and first and it just felt really uneasy.  

But then I figured out you can kind of control it by putting forms on it. I used the idea of a double helix and it gave a very serene effect. It was an incredible experience. It was as simple as thinking ""helix"" and the sense and image of one would emerge from the chaos and appear in it. I lost track of time just playing around, both seeing what I could project onto it but also experience from it in return.

It's an incredible experience. I haven't taken anything else tonight except for a coffee about an hour ago. Random rolling of red waves in no discernible pattern at the end.  Random shapes and patterns in a range of colors. Greens, blues, purple, white, red, black. Random shapes, monstrous creatures, faces, insects, owls, the moon, galaxies, large sailing ships on the ocean Random shapes, sometimes images that had partial shapes/feelings of shapes Random shapes; the ""flow"" of the flicker seemed to change. Sometimes I'd see a line of licker run across the bottom of the screen from left to right, or right to left, then see it coming from both the right side and the left side and culminating at the center; saw what seemed to be the whole screen sort of spinning or revolving around the center point; subtly, not vividly. Random square-like geometric shapes and patterns in the pulses.  Rapid heart beat in the very center with a fast moving train speeding across the screen in front of the heart. Almost like at a train station and the heart is on the opposite platform.  Rapidly changing multicolored geometric patterns that swirled, rotated, expanded/contracted, darted, or oozed Rapidly changing shape patterns and movements rapidly moving points of light that moved in diagonal directions primarily like as if someone were swinging a laser pointer back and forth as fast as possible. Those morphed into shapes that seemed to be gears meshing together, but in several layers, all moving in sync with each other. Various almost honeycombed patterns, but with rounded off corners. A bright center light with rays of light radiating out from the center like sunlight.  Rapidly spinning spiral galaxies and movement backwards and forwards through tunnels.  Astroid fields, crystals growing rapidly like frost. rectanglular shapes and circles and a dotted screen red and black Red and black blinking fast, maybe a center circle for a few seconds at a time. A little annoying after a while.  Red and black changed to red and blue after 1 minutes. After 3 minutes the colors began oscillating from side to side. After 5 minutes a full spectrum of colors was flashing in a picture like manner. After 7 minutes these colors began to take on a scene-like appearance. But these never became clear, only vague. Around the 10 minute mark bright flashes started intersplicing with the vague, color washed, scene-like pictures and that is where I closed the video. red and black flashes of course, the frequency seemed to change quite a bit.  Besides a ""checkerboard"" I saw a center focused pulsing of color and indefinable shapes. red and black flashes, I can see a line shape, like the blades of a fan constantly rotating. sometimes, the shape changes to a somewhat abstract shape, but still rotates clockwise. I also happen to turn my fan on at the time if that matters red and black line appear Red and blue skew above and below the screen
flickering square tiles smooth like bubbles
rotating simple kaleidoscope patterns with dull, faint rainbow color
1-2 bright lines across the screen, straight and rotating or spinning like a galaxy, sometimes with bright yellow and pink ""TV static"" inside
all visuals would be disrupted by blinking Red and yellow diagonal lines rounded tip  Red background changing to blueish/purple. Constant strobing effect making background color change with each strobe..White numbers and letters flashing briefly and moving from left to right.green trees in a skyline changing to buildings appeared complex yet pale ghostlike and drifting from top right to lower right the left to top left corner. I closed my eyes when I was finished and saw the most amazing turquoise.and purple square geometric shape the colors were mixing and swirling and somehow coming back to a multi circles inside the square (like a tv screen!) best part of the ganzflicker.  red black and white colors , screen warping red black flicker with images in line center  red black gray purple Red flashing with various blackish smudges flashing. red green and blue 3d grid Red Hearts , red circles , green circles, pebble like pattern Red light red lightning flashes, green flashes, darkening of outer edges of screen, feeling the screen was slowly moving towards me Red mostly flashing with dark, not appearing wholly black though. Faint thick lines or oblong shapes with irregular top or bottom edges like a wedge appeared infrequently. Red overall with some greenish/dark patches Red squares rotating, blue diamond shapes interlaced with red shapes, yellow here and there, text in the middle, images rotating in circles around the center, or in the center but never both, rectangles... red swirl in the middle and a big x in the middle of the screen. red zones,darkest zones, moving area, moving TV in the room as weel as other objects Red, black and blue randomness Red, black,yellow, orange. Green when I blinked. Sun in the middle, screen warping,lines radiating from center Red, blue, sometimes yellow, green laser lightshow. Sometimes swirling, often with strong lines that would stay for a few seconds and then morph into a new pattern Red, white, & Black at alternating speeds red. green blue flashes Red-black checkerboards and other symmetric patterns (both geometric and rotational), occasional diagonals of neon pink. Boundaries between colors, importantly, seemed artifacted, as though I was viewing a zoomed-in low-res JPEG. I suspect it was my brain beginning to get irritated at not being able to pin said boundaries down. Reddish - orange flashing screen. The flashing varied in speed, but it seemed to be on a cyclic pattern. I could not tell how long the pattern was before it looped. I saw a series of black dots on the top and bottom of the screen, which disappeared when I looked straight at them, like they only affected my blind spots. Reds and blacks, yes, and spinning. I saw blobs of white that would spray in the same space near the top of the shallow box I was looking into (the monitor) Remember seeing lots darker colors and lines crossing each other. Then the screen started to blink faster. Reminded me of the pattern on a common turtle's back. Repeating patterns. Mainly a plus + sign type geometry with four areas moving symmetrically. Then oval cloud like fields with lights flowing in between. Also swirling white and blue streaks. Was waiting for more.  Repeating shapes presented at the same interval. revolving vortexes that followed where I focused my field of vision Rings that expanded from the center outwards, eye like shape, dancing V shape across entire screen. ripples like a water droplet, colors other than red, a galaxy of stars"
