combined_ids,visual_vividness,hallucination_description
"989, 990, 992, 995, 998, 999, 1006, 1007, 1011, 1015, 1016, 1017, 1018, 1019, 1020, 1021, 1023, 1024, 1026, 1027, 1028, 1029, 1030, 1032, 1033, 1034, 1035, 1036, 1037, 1039, 1040, 1041, 1044, 1045, 1046, 1047, 1050, 1052, 1053, 1055, 1056, 1058, 1060, 1062, 1063, 1064, 1068, 1069, 1070, 1071, 1072, 1075, 1076, 1077, 1079, 1080, 1081, 1082, 1084, 1085, 1087, 1088, 1090, 1092, 1095, 1096, 1098, 1101, 1104, 1105, 1106, 1112, 1113, 1115, 1120, 1122, 1123, 1124, 1125, 1128, 1129, 1133, 1134, 1136, 1138, 1139, 1140, 1141, 1142, 1143, 1144, 1145, 1146, 1147, 1149, 1151, 1152, 1154, 1155, 1157",6,"Faces, squared shapes, trails Faces, the cars inside, planeta, tits Faint boulders caught in a whirlpool of red and other faint colors that I was falling into that occasionally branched. Faint circles or bubbles that began to merge together.  If I relaxed my eyes, it looked like the image was rotating, as if I were falling down into a spiraling red tunnel.  I would periodically close my eyes, because the blinking was giving me some mild headaches, but when I opened my eyes, whatever illusion I'd seen before had ended - but a new illusion would replace it.  At one point, it looked like a bright light was shining from the corner of the screen and pulsing into the center of the screen.  I wondered if this is what it felt like to travel on the surface of the sun.  I knew that it's all a simple optical trick, so I wondered if I could control what kinds of images I saw by thinking about specific things and then trying to find them in the flickering, but it didn't work very well.  I could, however, move the center of the spirals around the screen by willing it, and at times, it appeared as if there were two separate vortexes dancing around each other.  Maybe appeared as if there was some yellow mixed in with the red, but it was faint.  At one point, it almost looked like there were fractures or sharp webs of black, almost like fractals that were tearing themselves across the fields of red.   faint geometric Faint geometric grid of blobs, sometimes in a rotating ring. Mainly the screen appeared red but  the blobs appeared blue or yellow. All very insubstantial, however, like a sort of mottling over the screen - never anything vivid. Faint shapes made in on the screen Faint shapes made in on the screen Faint, abstract, largely symmetrical ""snowflake"" shapes. Marginally less faint, largely symmetrical patterns of horizontal and vertical bar-shaped blobs. Occasionally a ""vignette"" effect where the border of my screen was black and faded into the flashing red and black center. The red color occasionally turned yellower, but not quite orange. My eyes got sore quickly. Falling through wormholes, patters that fit the noise, funnel clouds over the ocean, volcano erupting, swamp with the trees with big roots, a ship, cannons firing, sugar cubes falling, large snowflakes, many snowflakes falling, rainbows(pink,yellow,orange,red,dark greenish blue) Most images were red, reddish orange and a varying dark greenish blue. Fans, a rainbow colored string fans, building in paris, two men walking fast black  blured disformed blots with movements. The movement changed when I moved where my eye focused. At the beginning there was a lot of blured blots but it was decreasing with time. At the end the red on the screen was much more vivid than the beginning. Fast moving letters and shapes, icons, etc Fast Tunnel-Fly-Throughs through tunnels made out of grids; Mandalas morphing into one another feeling of traveling in a circular canal Felt like I was falling down a tube or falling from a tall building from a future-esk environment. Had flickers of brutalistic buildings which contributed to dreamlike images of being in the Eastern bloc. few different patterns in rotation, with intense panning & zooming between them while it switches Field patterns intersecting. Forming a sort of fluid surface or movement through a particle accelerator animation at the same time. Patterns intersected as fields and produced new geometry. Started to fade into more cohesive objects, but also the presence of fieldwork rapidly increased until more depth related objects formed filigran patterns, centered color gradient, darker parts at the rim of the monitor filigree type pattern fireworks all over the screen, passing through a tunnel like hyperspace in ""star wars"", doing a flyby of the milky way galaxy,green color on the sides and center of image, kaleidoscope type patterns First a butterfly shape. Afterwards geometric swirling shapes. My visual noise (existent condition) got worse during and afterwards. First a mandala building from center to edge, then neon bars in different places on the screen, over the mandala but with a symmetry having nothing to do with the mandala form. The bars would change length (but never width). The mandala started rotating with the random neon bars appearing and also small fuzzy balls. 

The mandala became more structured and geometric and began to form into  objects, ""robots"", other kinds of images (a la minecraft). Then the depth of the space increased and it was like I was watching a road or train tracks speeding past as I looked down on it. There was a sense of ""tunnel"".

This began to interchange with relatively ""blank"" spaces with curving lines, very much the shape of a ( , but larger scattered in a much more random pattern than the mandala. More like a Kaleidoscope.

Then the images started ""repeating"". Not literally or exactly, but the sequence of types of images started over. I watched those for a couple of minutes and when nothing new was happening I stopped at about the 7 minute mark. First a mirror, then horse then horse portrait  First a starburst in the middle, like the eye of Sauron. The screen began to move in small circle. Crackles, like a crumbled then smoothed paper. Dark purple once. And I saw the door! an arched door, like from a church or castle.  First came the geometries, then symbols, they all kept floating still in their areas of the screen. After 40 seconds or something, I saw a bright light in the middle and it started gravitating in circles around the screen, first in the horizontal axis, then all around the screen whilst all the other ""symbol geometries"" came flying with it, as if it was a planet pulling everything to its movement, kind of like satellites following it. After a minute and a half I started feeling a very unpleasant feeling and thought that if I kept staring, I'd be sent to another dimension? Something weird, so I had to stop it. All in all it was a difficult, yet cool experience. First changing colors, then swarms of dragonflies, then wildflowers and dragonflies plus butterflies first changing radiation pattern, gradually the screen become larger and other colors come in, and complex pictures show up but dont have time to look carefully and then my screen saver is activated first geometrical objects grids, stars and then cartoon like drawings, more complex shapes and eventually cityscapes evolving into space and producing wavelike patterns  first greens, then yellows, then silver-white letter-like shapes, then 6, then 5, then a scrolling through different numbers in that spot; more similar things over time. First I felt a looming sensation, as if the screen were getting larger as I watched. This soon alternated with simple pulsing geometric shapes (circles, triangles, arcs) and patterns (checkerboard, stripe). Then came strong sensations of optic flow, as if I were being carried along a tunnel or path, or moving along next to a wall. I developed a sensation of green and blue, which resolved into the sensation of a forest (however, I didn't feel that I ""saw"" the trees, but I had the sense that they were there). This went back to geometric shapes, and scintillating concentric rings, before developing into a sense of vertical energy--which my mind coded as a skyscraper (even though, again, I didn't ""see"" the skyscraper as I would with mental imagery). Then back to geometric shapes and patterns. (One caveat is that my monitor went to sleep a couple of times while I was viewing the ganzflicker, but I found that the imagery came back rapidly after waking the monitor up.) First I saw a corridor full of closed doors.  At the end was a person standing there with light behind him.  I didn’t know who it was but was trying eagerly to get a better view.  Suddenly everything changed into a strobing heart.  I thought it was me thinking of you and tried to not focus on you to avoid feeling primed.
Then in the blink of an eye I saw two sumo wrestlers giving their one foot, two foot, ready, set, go!  They smashed into each other over and over until finally one overcame the other.  The two of them began tumbling out of control down a slope and hit a guard rail or something because they stopped with a squish and jiggle.  I could only see bare skin and then, “Vooomp!” They were sucked into the background like an elephant being sucked into a straw.  But not only the wrestlers, the whole screen.  And then the whole screen again, and again, over and over.  After a short moment, I realized I was looking at a flower blooming in reverse.  My screen went dark and I had to move the mouse.  At that point I saw something very different.  A face staring back at me.  It wasn’t human.  It looked like a lizard, a serpent.  It was trying to talk to me but all I could focus on was it’s eyes.  A moment later it took off flying and I could tell it was a dragon.  The dragon kept flying faster and faster, starting to do barrel rolls close to me so that the strobing was actually the wings rolling past me with great speed.  The dragon disappeared and instantly reappeared flying loops around me with the same veracity.  It felt like something was about to happen, I felt like it was circling tighter and tighter.  Then the white noise stopped and I was pulled out of the trance
 First I saw a few lines varying in orientation from either end of the screen. Then I began to see circles. The circles became more and more, resembling a birds-eye-view of a drop of water dropped into waters, appearing to be quite realistic for short durations. A lot of lines and axially symmetrically shapes appeared. Towards the end of the experiment, I witnessed said fast rotating spirals, with one end of the spiral disc being closer to me than the other end. At some point I was in between two sprialing discs. Some spiraling discs wandered further into the background. first i saw a pink lotus opening. Then I saw some green amorphous shapes. Then there was an eye in the center that turned down on the left side. Then the eye slid diagonally down the screen First I saw a woman riding a bike on a shady path and falling to one side. The image changed to one of a woman sitting in a hard plastic chair in a rectangle room, her skin was made of something clear and gelatinous like jello. She morphed into a nude woman sitting on the grass crying. After that I began to see more landscape type visuals of rolling hills and tall grass. Oddly disfigured or alien animals kept appearing in the landscape with looks of happiness or anguish on their faces. The last thing I saw was a horse with the eyes of a human galloping across a plateau and staring at me sideways. First I saw stick figures, like cave paintings, then it morphed into landscapes, fields with stone walls.  I could see the fields were green even though the red and black were dominating First I saw this white colored ball with lines coming out of it, and at it's centre it started getting brighter with a yellow like color and expanding. It then seemed to explode into what looks like a galaxy, similar to how the milky way looks. Then it started getting more vivid (more color and looked more realistic), and transitioning into mechanical looking objects. Some looked like they were made with steel or titanium, with one looking like the imperial star destroyer (from star wars) without anything protruding from the top and a hollow triangle shape in the middle. Some looked like a tall glass chamber like some nano gram scales. 

Then it transitioned into these 2d square shapes that looked like they were tied together with lines, inside them they had another square perfectly centred and then the same again. After that it seemed to quickly come together and explode into multiple colors covering the screen seperated by lines. I stopped after that because it was getting uncomfortable after about 60-90 seconds. First I saw two vertical and parallel lines, which later separated into pieces and started swirling around creating a circle. As the circle girated I could also see shapes in the center spin. First an X then a plus sign, then an asterix (both). After it spun for a while the circle slowed down, it decomposed itself to spinning the DNA helix shape until it further decomposed and slowed down to form the 2 parallel lines at the beginning. First I saw what looked like neural synapses and then I saw what looked like ripples in the water first I was very close to the screen and it was flickering in grey and red, then red and blue, the blue phases seemed to become longer. After a while I moved my head farther away from the screen, the blue disappeared, it was mainly red, sometimes with yellow and white areas. Now I started to see patterns. I saw balls (later circles) of light, sometimes one in the center, sometimes several. Sometimes the patterns were symmetrical - same patterns on the left and on the right half of the screen, somethimes it was chaotic. Later there were shadow-like greyish darker objects with long rounded shapes like rounded off dark bars moving fast in a row, like all running after each other in one direction. Sometimes the light seemed to become larger and radiate out of the size of the screen, the shape of the screen seemed to change constantly, sometimes the image seemed to rotate. Towards the end, the screen had a sharp and clear outline on the outside but on the inside there was like a thin dark bordure that looked like lace or foam or small bubbles. This bordure was quite stable, it stayed for a long time, also when I moved my eyes or my head - until I turned on the light in the room and closed the tab. First it was a silhouette of a theater mask morphing into a face immediately. Then I got scared so I turned it off. Then the second time I tried it, I saw first a big flame in the middle. And inside the middle of the flame was a dancing figure. When I blinked another image came where there are the flickering embers of fire escaping the body of fire itself. And my view started going Lower and lower into the fire until I can see it expanding out to show a group of kids sitting around the campfire only for the fire to change into a small one inside a lantern. First it was black strips, but I would move my eye trying to count the straps and than images began to form. Buildings or trees mostly but I blinked and I saw an elephant every time I had to blink I saw an elephant on the screen when I opened my eyes again  First light in the form of lines, outline side profile, semi frontal face First lines then balls of lightning around my periphery. After about 5minutes there was enough lines to make a forest like outline that was greenish but changed colors often, different shades of green, black, brown, and gray First mostly a grassy field. I could definitely see blue, green, and orange in addition to the black and red.  Then it changed to white splashes of light, dots, and lightning. Then 3D geometric shapes all over the place.  Like I could reach out and touch them.  A field of grass always appeared just above the screen, like in my living room. first saw a bunch of something fractal-like, but not quite that gradually began to become rounder and rounder, then. when it got fully round, it was as if an solid point was brighter in the middle of the fractal than the rest of the screen (this followed my gaze). 
Eventually it transformed into a thing rotating that were ""shooting laser"", (kinda like a plasma ball but in 2 d and with only 1 to 4 lines that has the plasma ball beam's behavior) from the gaze to the border of my screen
enventually, it was as if i was going through a tunnel kinda like this image : https://c8.alamy.com/comp/R7JDW8/flight-over-neon-light-tunnel-cyberspace-wormhole-sci-fi-space-travel-3d-render-motion-design-of-spaceship-warp-flight-R7JDW8.jpg where i was looking was affecting the angle of the tunnel altho it kept changing randomly. i wasn't sure if my screen was doing some weird flicker things so i stepped away, looked from a distance and noticed the lack of all those black pattern. sometime, it felt like it was just because of my screen refresh rate, but after doing that, im not so sure anymore. First some very faint green dots, then some very faint blue dots mixed in.  After a while the began to rotate in sort of a swirl. They were so faint, it was hard to tell if I was really seeing them. First there were shapes of a heart that was pulsing and morphing into other shapes. Like an X or a circle. Then a person's face appeared. His head was shaking about. I could only see half of his torso and shoulders. Eventually he started slamming his head against the screen. Harder and harder. His facial features began to become more vivid. Then he turned and started choking someone. And was grabbing his head and slamming into onto the floor. That's when I stopped watching it. I couldn't take anymore of it. Was making me feel sick.  First there were various shapes that seemed to get larger and larger and then engulf me, one after another. The shapes got progressively more complex; they started as diamonds and circles and then turned into spider webs and bow ties. When the 10 minutes was almost up I began to see outlines of figures or very specific objects. First thing I remember was seeing something like a lightning storm, followed by a giant mushroom in the storm. Went to the underside of the mushrooming looked up. After that saw a lady with a hat and a weird face, followed by a mountain  First, a landscape, looking over a cliff from a mountain onto a valley, and more mountains in the background, with lots of trees. This persisted quite a while. Then long spider legs spiraling into the image, consuming it. Then the galaxy, edge on, sometimes rotating upwards. Many of space. Then it would all go ""blank""---this happened several times. Sometimes it would take a while for it to start again, but never so detailed or specific as the mountain scene. Lots of kaleidoscopic images moving extremely fast. The most disturbing part was halfway through. I realized I had been staring in the center and not looking at the edges. I moved my eyes to the right and realized that the circle swirl I had been watching in the center moved with my eyes. I thought it couldn't possibly be following me. So then I moved to the left, then right, then left and center---and it followed me. I became very uncomfortable and it must have ""broken the spell"" because it disappeared and never returned. At the height of my discomfort, I was convinced that it wasn't following me, but I was controlling what I was watching---my observation was determining what I was seeing. Well, yes, but I didn't think it would respond so strongly. First, geometric shapes, but they went by too fast to identify.  Then a great point, rising up from the bottom to the top of the screen.  Nothing for a little while, then what seems like bubbles, shooting past me as if I was travelling at warp speed through space. first, indistinct motion, like trying to see someone moving in shady trees.
next, polka dots flashed on the left half of the screen.
A skull, iconic not realistic
A squiggly alligator, that became a car and drove off up a city street lined with buildings, all like it was drawn by Harold, with his purple crayon, although these lines were black.
Blue triangles.
Rotating tunnels, leading into the screen, repeatedly Firstly i saw a human's eye after that it's changed to an eagle's eye. The image went away and I saw the eagle more clearly. In very short moments, I saw a human form with horns. Firstly i saw shapes then ,long coridor and asian language  Firstly I saw what looked like trees, arching over , palm trees, this morphed into a vaulted cathedral roof, then a tree lined avenue.

After a respite i saw what looked like insect parts, bees bodies with blurred flying wings, either very large or I was close in, like a macro lens.

Other insect parts - moths antenna - the feather-like ones. mandibles.

then teeth, like skeletal jaws. 

finally it was like looking off the back of a speeding train as the line and subway disappeared into the distance.

 Firt it looked like fan blades spinning, then a kaleidoscope with red and blue. After a couple minutes more the center looked like a large bird or dragon flapping it's wings slowly, like it was a very large animal. This morphed into a sort of side view that looked more blood a red butterfly, though no discernable features on either. Like it was blurry or distant.  fisrt geometric patterns in grren, brown, black and red ( a bit like multiple small mandala arragend into a full screen pattern, mostly round shapes), 2 pairs of eyes left and right on the screen, the monoitor seemd to move closer a few times, seeing a blond boy flyning along a stoney tunnel (like superman), walking trouugh a stone portal (like a castle) and walking down its stony grey corridors, a dacncing girl shaking her hipps morohed into a kitchen aid stiring dough Fists coming down, someone crying, a murder, etc Flares, Grey and sometimes Blue color, Maze, rotating ""sticks""/""keys"" flash  Flashed yellow during first 3 or so minutes Flashes mostly star bursts cross hairs andfirework type explosions Flashes of colours..blue, yellow, green
 Flashes of different colors Flashes, light explosions (as in a video game or animated show, not the obvious flashing from red to black, and not realistic explosions), moving simple objects with afterimages, different colors (blue and green), moving cones of light, regular vertical banding, and after a while anything I was thinking about. Flashing blobs of purples and blues that resembled an oversaturated rorschach test, with a faint grid in the background. Pulsing band of yellow at the perimeter of the screen. And venting static flowing away from the edges of the screen, similar to what you might see in a Tool video. Flashing lights Flashing lights Flashing lights Flashing of white color like lightning on all periphery of my phone screen and my face because screen is like mirror Flashing orange and dark screen, sometimes seemed to be scrolling left or right. Flashing X patterns that slowly started to spin counter-clockwise until a small portion of the screen was a spinning spiral. The flickering also seemed to slow down drastically as if time was slowing down flickering Flickering betwyred black and white  flickering colors, lights and shapes Flickering colours were many colours and constantly changing around. Images were from the middle and like were they were forming then growing from the middle before starting again and evolving. Like a heart shape, then a cross, then the cross spinning, then it’s like a tunnel one way, then it spun the otherway. The background colour changing. These images were not very vivid and took awhile to start beyond just the red and black. The blue and yellow flickers started first.  flickering light sometimes a very faint images couldn't make it properly though Flickering red and orange light Flickering red light, pulses varied, tried to identify  a repetitive pattern but couldn't. I found it irritating so didn't complete the 10 mins. Flickering streaks and scratches as if watching old movie reel Flickering turning into pulsing in various directions Flickers of lines and webs  Flicking lights converging into the center like travelling through space floaters, 2 triangles pointed towards each other in an hourglass shape, the Hebrew Tree of Life diagram, capital letter ""A,"" a starburst, the screen seemed to changed from mostly red to a dark orange. Flower, colors, river, waterfall, hearth shape Flowers growing, animals walking in parade flowers, circles and shapes, automobiles, clouds, devil horns Flowers, crosses, equals sign, Washington monument-type shape, a pretty vivid giraffe, thin purple lightning at the end, the colors orange, blue, and green a little. Not crazy vivid, but interesting to see some outlines Flowers, landscapes with an open sky and almost like lightning bursting through Flowers, like zinnias, opening in various areas if the screen. A hallway in the distance the seemed to open up in the center if the screen and move upward, then a figure walking through.  Flowery webs that are growing out of the screen and some trails like water drips diagonally across the right side of the screen Flowing and weaving patterns. Red & green colours. When I closed my eyes there were very clear purple & yellow moving geometric patterns.  Flowing, shifting geometric patterns — most often V shapes, inverted Vs, rapidly spinning circles or spirals, or Xs — that sometimes seemed to expand beyond the edges of the monitor.
Occasionally, one of the patterns, especially the circles and spirals, would briefly register in my mind as a spinning circular room with elaborate columns around the periphery before I lost focus or had to blink and the image was gone. Flying 1st person perspective, birds Flying, horses running, 2 silhouettes in conversation, supernovas Flying past mountains on the left, then flying past them on the right, each mountain different size/shape than the previous Flying through tunnels with checkerboard walls, or twisting around checkerboard landscapes in space, like old 1980s computer graphics; flying over an ocean, zooming forward, until there was a faint city on the horizon; several indistinct faces hiding, fading in and out like they were shy, sometimes lingering a little longer or opening their eyes to peer curiously out of the screen; whirlpools of light, sometimes one, but usually two or more; a girl standing under a tree in the rain, holding an umbrella with lace around its fringe, looking down at the ground. Most were faint patterns, but the last one was more distinct. for a few seconds I saw this line of light as a thunder (very brief though) For about 2 minutes I saw colors other than black and red, and after a few minutes I saw the face of my loved one."
