combined_ids,visual_vividness,hallucination_description
"3, 5, 6, 7, 8, 9, 12, 14, 15, 17, 18, 19, 21, 24, 27, 30, 31, 36, 37, 39, 40, 41, 42, 45, 46, 47, 48, 49, 50, 53, 58, 62, 65, 67, 69, 73, 75, 77, 78, 81, 84, 88, 91, 93, 94, 95, 96, 97, 98, 99, 101, 102, 103, 104, 105, 106, 108, 109, 110, 111, 114, 115, 116, 117, 118, 120, 121, 122, 124, 125, 128, 132, 135, 137, 138, 140, 141, 142, 143, 145, 147, 151, 156, 162, 163, 164, 165, 166, 168, 169, 170, 171, 172, 174, 176, 177, 178, 180, 181, 182",8," corridor with bright windows geometric patterns, as seen in 2D FFT output given low-spatial-frequency luminance modulation (with input emphasizing vertical and horizontal orientations)  I saw flashes and laser like lines of yellow and light red/pink, a little green.   I saw the rain poured in the marble brick that outside the house. I was in the house when the rain happened. The rain was heavy. And the house that I live had old, and traditional   images appear on the screen  Move up and to right, also would look green  pusating light began red and black, morphed into red and green; later, red color dominiated and changed shade from orangy to deeper red; some glittery gold spots. Images: a city skyline, gold cubes, gold dots 
Dark gray Hexagonal lattice appeared on screen occasionally.  Flashing Red, Pink, Black background with white sometimes in center. 
Flashing colors (red>black/gray>blue>green) and amorphous shapes (cloud-like).  Sense of moving very fast through colored clouds or nebulae.   ""stars"" that got relatively bright, a cityscape outline, some random shapes, the alien figure... everything I saw was in some sort of motion (Note: I interpreted ""images"" to include ""simple shapes or patterns"" and ""colors other than red and black"". If ""images"" only refers to figurative images, please disregard my answers to those questions.)

The screen soon seemed to be divided into square tiles, usually with an orange and blue checkered pattern, although sometimes it was more complex with dark green tiles of a different shape at the corners of the other tiles. The dark green tiles were covered in a pattern of irregular, little, curly scratches. The flickers came to more or less fill my visual field. Sometimes, I'd start to see little spinning wheels around the periphery, showing through the checkered pattern, also decorated with these irregular, little, curly scratches.

Bright orange and dark blue/purple predominated. An especially bright orange/yellow glow appeared in the center of the screen. It sometimes became the center of an asterisk, with bright lines extending to the edges of my visual field. The bright lines consisted of parallel stripes of different colors, like rainbows. At one point, I saw a collection of such rainbow lines extending across my visual field from a point low down and central. Sometimes thick, bright lines would appear at various angles and offsets from the center. These lines had bright and dark bands alternating along their length. Sometimes the bright and dark bands would seem to be moving along the lines. If I concentrated, I could change the direction of movement.

When I closed my eyes, the background became paler and I'd see a network like a cobweb (centered on the middle of my visual field) of pastel green threads with pastel blue jewels at the nodes where threads met. * A grid of boxes
* Bits of blue static
* A circular vortex in the middle whenever I refocused
* Long straight lines, like an embossing, that grew and divided and moved ,,,first, thin slitted nose belonging to nonthreatentity , music drops bursting happily increasing till Wednesday said stun, stun, sun, sun , yellow filled my tastebuds reminding myself of dandelions 1 min or so in, I'm seeing the changing black and red frames neither slowing or increasing at that point. but then the image took the form of a solid golden tablet like shape, and words started flying across it with a scenery in the background that resembled a beach. that was through my eyes what I was seeing off of the screen, but I was thinking of mental images of what it would look like if I met the people who made this experiment. i saw my self shaking my hands with him or her then my attention went back to the screen and the image disappeared and it went back to flashing again.  i then proceeded to exit the window while hearing small giggling noises in my room. I'm pretty sure those were mental audio clips stored in my head since it is 11 pm and everyone is downstairs sleeping. 1) Started off as changing from red/black to going red/blue 2) 1-2 mins Then looked like water ripples in bottom left moving to top right and random turbulent water swirls. 3) 2-3 mins a clockwise spinning saw blade at the top of the screen 4) 3-5 mins.  The belly, front shoulder, legs, and feet of a running horse.  It looked like it was running so fast it had flames coming off it's hooves. 5) 5-7mins.  I blinked rapidly a bunch of times like trying to make a movie scene, but it ended up creating fat pixels on the screen and they stayed static for a couple mins. 6) 7-10 random swirls and brief flashes of the former images. (Times are approx) 1.X or I shaped yellow laser lights, just like those in windows media player, with blue or purple shade 2.round or square pattern all over the screen 3.fake chinese or japanese characters (i know these languages so i can tell that they are imaginary) 4.scenery running backward as what we see when driving 1/ Clusters of circles (about 100) growing in size over the span of 10 minutes. They appeared right at the beginning. At the beginning, blinking seemed to reduce their size, but they gradually grew larger until I could only see 3-4 on the screen. They were centered. As they grew bigger, they were starting to look like ripples or concentric circles.
2/ A cityscape. It appeared once, around 2-3 minutes in and lasted for 10-15 seconds. It may have lasted longer, but at this point the circles took my attention. It was brighter, yellow and was on the right side of the screen, vertically toward the center. It was not very detailed.
3/The flickering sometimes seemed to slow down and speed up and although at the beginning it was clearly flickering between black and red, the black ended up looking like desaturated and dark green.
4/ On my peripheral vision, outside the screen, some noise was present the whole time and on the borders of the screen but inside it, their were radial lines (only appearing on the borders) with color distorsion (red/blue/yellow). I started seeing green and blue, then beige/tan colors about 3-4 minutes in. Spiderweb-type designs, mandala/kaleidoscope designs all over the screen. A lot of focus on the center, looked like an iris of an eye, small white sphere in the center and webs coming off in every direction the edges of the screen slowly felt like they were becoming darker with more black as time went on and i startedseeing hues of orange where the black hit the rid during the flicker I first saw the rectangle of the screen expanding and contracting, then a yellow-orange ""X"" formed by connecting the corners. Little swirls of lines began to form that jumped along the ""X"" that I turned into stick figure people in my mind's eye. Once I had that thought, the X turned into a dragon that seemed to be writhing with anger as he lunged at the stick figures that had begun to throw spears at the dragon. The dragon ate some of them and scorched the rest so that I noticed the black flashes mostly at the bottom of my screen while the dragon remained orange outlined with yellow mostly toward the top of the screen. His wings unfolded to stretch and frame the top of the screen and he began bursting with flashes of light as though he had leveled up his fire breathing abilities to atomic blast sequences. I got a little overwhelmed by the imagery at that point and tried to steer the visualization in a calmer direction by turning the screen into a live video of a lava fall (the white noise reminded me of the deafening sound of a large waterfall when you're standing beneath it). The ""X"" eventually came back, but I made it glow with rounded edges to turn it into a butterfly. In this order I saw mathematical equations that were almost Einstein complex, symmetrical honeycombs with tiny cartoon bees in the center, an old black and white 1900's photograph with at least 15 people, mostly females in traditional clothing, a view from inside a fast moving train with lights zooming by almost as if the train was going to derail. I saw a dark, scary abyss that was spiraling towards me, the black growing larger as if I felt like I was spinning. Then the images would repeat again in the same order. At the very end before I clicked off, all 4 corners looked like some sort of vines were growing into the center of the screen, like in the tv show Stranger Things. I saw mathematical equations similar to Einstein's, then switched to symmetrical honeycomb shapes all lined up with somewhat cartoonish bees in the middle of the honeycombs all symmetrical, then switched to a black and white photograph from the 1900's with many women dressed in dress uniforms all standing in rows, then I was inside a train that was in a tunnel with lights outside zooming by fast like the train was going to crash. These images repeated and the final scene which only appeared once at the end of the session after the train was there were these black vine like things that started in all four corners and slowly moved inward towards the middle, similar to the vines in Stranger Things. Then it went black. To begin with, it was just red and black flickering, but as I watched for longer I saw flashes of yellow mix in. And then pink and blue as well. Shapes where constantly morphing and changing. Mostly blank on a coloured background. Around the edge of the screen black lines flicked back a forth (creating the perception of train carriages moving fast in front of you). And occasionally black blobs (mostly circular-ish) moved (constantly changing) over the centre of the screen. Often forming shapes similar to pressing paint between a piece of paper (like the 'butterflies' you make with 3 yr olds).

Through out the whole process, I could reset the shapes and colours (only seeing red and black flashing) by focusing on a point within the screen, but as soon as I let my eye out of concentrated focus other colours and shapes reappeared. I could mainly see shapes and lines rather than proper images but these were persistent after a minute of looking at the Ganzflicker. The lines and shapes also disappeared if I looked directly at them.  I saw different shapes and colours  Shifting, incredibly fast flickering of faces, eyes, mouths, some animals- not much else. It was a bit scary, faces had neutral to unpleasant expressions. They were mostly transparent. I had repeats of the same image spinning in pinwheels around a single point, similar to light psychedelic visuals but with less fluidity/motion and more staccato/jaggedness. The images weren't all the same size & varied by a few centimeters. Each image would appear for just long enough to grasp what it was before my eyes could actually process it and notice detail. Then it would turn into something new. The actual wheel itself would stay in the same place, or drift around slowly, or cut to a new one elsewhere after maybe 15-30 seconds. I had some fingerprint-like spirals and a flashing/electric horizon line in the center of my screen sometimes. More than 1 pinwheel was present sometimes too.

I think my brain wants to see single images but can only project them 100x over. Maybe it thinks I have bug eyes. LOTS OF SPIRALS AND GEOMETRIC SHAPES. THEY FELT LIKE THEY WERE COMING OUT OF THE SCREEN AND I WAS IN A TRANCE LIKE EXPERIENCE.  rapid movement of lines, shapes and circles  lines
triangles
a star shape 
geometric patterns 
a hand 
squiggles 
and the Eiffel tower My imagery was not so much a specific thing, as a cool wave of patterns that i could control with my eye movement.  Waves of motion clockwise, counter clockwise, pulses up and down as i thought about how i wanted them to move.  The flickering was disturbing at first, then very relaxing. 2 closed hands, then a map of europe with weird blue arrows and then strange square-ish things moving 2 point perspective to a blue point, sometimes almost all red, pulsing and lava lamp like movements 2d fractals blending into tunnels with view points changes 2x 3d pyramids stick together, I just googled it, bipyramid. It was spinning and rotating. Blurry bold edges but interior facets were very sharp and distinct. Occasionally I'd see straight lines like I was looking at the inside of a corner of a cube. I saw one instance of a straight rainbow line sort of like I was looking through a prism. 3 horizontal bands across the screen of shifting squiggles on a darker background, blocks of partially outlined in white rectangles with complex squiggle shapes inside which shifted in intensity and squiggle pattern with the flashing of the colors, but which were fairly stable throughout the overall pattern as it cycled through back and red patterns 4 vertical lines   then ~ ~~~~ these looking lines 5 proopeller at the same moment,white,blue,black,yellow colors in the screen 5 sided light green umbrella tops spinning. Another time I saw bubbles, like a diver sees when scuba diving. Another time I was seeing what looked like neutrons forming in the center then exploding out. 50s looking diner to a forest to floating eye balls, to round swirling shapes then an incoming spiral of light being flung around me horizon line, rainbow, grid, moving forward sensation just white / bright circles / ball of lights. kind of like when you're looking into the sun for a while and then close your eyes and just see a bright ball of light  A 3d spinning cog, a space-station like that of 2000 space odyssey a similar, a mario-cart like car and a ship on sea. A ball bouncing and stripes flashing  a ball circled around, first on a wall then on a floor. Then lines danced around between left and right side A ball made of smaller balls rotating in the centre. Dali style tessellations of birds, butterflies and arrows a ball of multi-colored light that moved around. I could move it by moving my eyes around the screen sort of like it followed my vision A big chessboard a bird,  a face that morphed into many faces and a building a bird, a flower, a chessboard, an amusement park ride A bit unpleasant. Burned my eyes afterwards like having an eye test with those drops they use for eye dilation  A black/red alternating grid pattern which shifted in size over time A blinking eye, a road, a snowstorm A bright red oval in the middle with a bright red border around the edges of the screen with flickering and morphing black lines and filaments connecting the two, and occasionally white lines a building in a school, with lots of layers and windows, no roof. A bunch of cosmetic red, black, and beige shapes, rotating eyes, screen tearing, the screen bending, the birdseye view of a city. A bunch of geometric shapes, then the pyramids of giza almost constantly A bunch of spheres and circular imagery that popped in and out rappidly A butterfly emerging from a cocoon. City in the distance. A couple dancing. A worm or snake… can’t think of all of them, but those were the most vivid A carridor with a doorway at the end A cascade of storyboards like images playing out the evolution  of the cosmos. Star birth, black hole transformation, dark matter raising the cosmos.species raise and fall. Stories offered and picked as I went. 

Yes intense and useful tool. A church, a man in hood, an injector, a maple leaf and a bottle. A circle in the middle, lines converging (vertical and diagnol to screen) A circle of darkness in the centre of the image, distinct lines sparking throughout from the centre. In a circle is where the lines shown out, was great! lol A circle of lights spinning and different colors. a circle with lines going to it a city lanscape A coastal area with a castle built on a hillside, a river that ran between two cliffs in a canyon that towered above me, a monster's face, intricaye patterns, a skyscape at night A constant firing geometric landscape, which shifted into a series of tunnels that I was going into. The direction of motion changed. At some points I saw completely different colors like a blue sky with a white disc. In the last few min I used my minds eye to try to imagine I was looking at the corner of a wall which caused the images to shift radically and split the view into two, the left side being organic slow blobs and the right side rapidly rotating geometric patterns.  I had the distinct feeling at multiple times that I was viewing real places. The blinking and red went away completely and I was sailing smoothly over different scenes. A constantly shifting, yet sometimes stagnant rotation of different patterns. sometimes, a cross would form, other times it would seem as if the flicker formed a spiral-like pattern. sometimes it would even look like a checkerboard of red and black. mostly unpleasant to look at, but I don't like red personally. started to strain my eyes after two or so minutes. A continuous visual flow out of two over lapping portals. Everything was evolving so quickly it was hard to keep up with. This must be opening the flood gates to your subconscious. A cross A cross that centers where my eye was looking was persistent the entire time. Meaning 1 column and one row about an inch in size. Many squiggly lines, similar to looking at a bright sky and seeing floaters. But more of them and constant. The most intense object was I started seeing the creases in my pants appear inside the image and it reminded me of a hand which scared me. As soon I realized what it was from, it went away. A dark hallway at first,  then lines, geometric shaoes, pattern, then rotating green A diamond shape in center from a smudge on my screen that radiated as it flashed red and black on the screen.  The edges  of my phones border moved inwars5with each flash. I only watched it for a few moments before stopping.  I didn't listen to the white noise. Just the imagery. A dimension composed purely of spirals. Geometric shapes, some of which had eyes in them which were glowing green. Distortions. Spinning triangles. A dozen or so white beacons would rotate in tandem as if attached to an invisible 3D structure, the occurred a few times in the first 5 minutes and was overlaid on the flashing colors. Constantly saw colors other than red and black. Visual field would be overlaid with a variety of geometry from grids, circles, or blooms. Also would see a small circle of distorted grey ‘smoke’ in the center of my vision if I intentionally looked deeper into the screen as if it were 3D. Have experienced the same thing before encountering hypnagogic imagery. After watching the flicker I closed my eyes and saw a small structure to my right that I couldn’t identify but seemed to be like looking down onto a space as if it were illuminated by moonlight. This faded after 10 seconds and my field was dominated by intertwining transparent green tendrils that had fractal qualities and moved. The smokey distortion was present in the center. Visuals slowly faded after about 3 minutes A dry cracked desert, a man holding somethi g and turning to look at me, a bright street light on a dark street with tall buildings either side, a lions face but like a poster not like a real lion A face  a face apeared and it started to deconstruct itself into the solar system there was a large spiral that overlaid itself over the solar system and the planets started to rotate adhering to the spiral which resembled the number 9 it combined into itself and created the image of a sunset on the ocean then it morphed into a big iron gate and then it morphed back into a face A face slowly lifting its head to up. A lot of eyes everywhere on screen. Eyes making flower like something. I see a pond with a space rocket going up, some stars, it was like a kid's drawing not moving just stars changing. Lines looks like letters or patterns moving around changing everytime. I see a lot of color changes.  A Face, Tunnels, Squares A few blurry faces that never materialized.  A moving subway tunnel or covered roller coaster.  An alien figure.  A sci-fi worm hole and dome space craft.  X was predominant toward the end of time. different colors, moving shadows and lines,  Patterns of what looked like a man's face moving rapidly I was seeing many geometric patterns and several doorways and also arrows and a sun. The colors were blue, purple, pink, yellow, red, black and maybe some green.  started with a star pattern, then went into some lines, overall lots of fractal like images that would either appear and just grow the way fractals do around to the edge of the screen or it would rotate like a wheel in both directions, sometimes going from a flat circle to falling away from me so it would be more oblong, like a tire that fell over.  Reminded me a lot of what I see on the backs of my eyelids sometimes. I noticed that as time went on the pattern of a 5 pointed star became more complicated to something closer to a 12 pointed star. Patterns would be mostly symmetrical, but could move in asymmetrical ways- like if I saw two circle fractally shapes next to each other just outside the center of the screen, one may rotate and the other would fall over and then rotate off screen.  I said I saw other colors, mostly like oranges and the gradient that is between that red and black, so like I said - oranges, but then into browns and such. Flickering rainbows, bright dots like stars rushing past, turning wheels of light, spirals, a spaceship, train tracks, a corridor with a door at the end It started with a pulse, like a speaker center, beating. It then started to turn and the area around started to churn counter clockwise to the beat. This split into two, where each center pulse started to fall deeper into the image, turning both into circling vortexes. The vortexes spun around like each other like a binary star circling, connected at the center giving each other matter to consume.

Moving into the image, it flies forward, around a mountain, into a valley, a town near the river, the river letting into a large lake, the lake deep, going into the lake, going into another vortex.

Moving down on a planet, landing in a forest, seeing the path from wizard of oz. 

Waves crashing, an ocean in a storm. A few times, for a half second or so, I saw images of a large city like Manhattan, but from above the skyscrapers, and very quickly the ""telephoto"" lens zoomed out. Also there were moments of fractal-ish spiderwebs. I wanted those to continue, but they didn't. I realized my mind could make very basic images move left to right and back, up and down. I experimented by blinking my eyes and one thing I thought was weird was an interrupted, blank moment before the mostly red, sometimes black and rarer times blue colors floated around. I wanted it all to be far more trippy, and when it wasn't happening it felt like doing meditation again after not doing it for a long time: too much ""monkey chatter"" but here: too much chaos in visual field. Not enough smooth organization that developed into anything. I'd start to get there...but then I'd be back to where I started. Also: I think I may have had too much caffeine in my system and that might have hindered the advent of psychedelic imagery that I had desired. A figure of a human being moving side to side, flicker of random images A fireball bouncing up and down while surrounded by fractels A forest passing by rapidly, as if I were on a train passing by it. the black shadows took the shape of trees and the red filtered through like setting sunlight. Sometimes the perspective would change and it looked like i was looking up from the forest floor as i rapidly passed under the leaves, or was spinning very quickly while looking up at the sunlit treetops. there was no natural colors, just red light and shadows. A futuristic car slowly leaving a parking lot of a tall glass building a geometric tunnel, that felt as if I was moving into it a green ball of light that moved over the screen, spiderwebs, grids, a large building or fort, a moving car  A grid with red and green colors, different shades of red, like a checkered shirt a group of words/ a phrase that was repeated over several lines; simultaneously there were lightning strikes, balls of light atop a mountain A harbor scene, Woody woodpecker in color, few birds and butterflies, spirals, driving down a road,  A head and body, but no features. A house, trees without leaves "
