combined_ids,visual_vividness,hallucination_description
"1948, 1949, 1951, 1952, 1953, 1954, 1955, 1956, 1957, 1959, 1960, 1961, 1962, 1964, 1965, 1966, 1967, 1968, 1969, 1970, 1974, 1975, 1979, 1980, 1981, 1983, 1985, 1988, 1989, 1991, 1992, 1994, 1996, 1997, 1998, 2002, 2003, 2004, 2005, 2007, 2008, 2009, 2010, 2013, 2014, 2016, 2017, 2018, 2019, 2022, 2023, 2025, 2029, 2031, 2032, 2035, 2037, 2038, 2039, 2040, 2041, 2042, 2043, 2044, 2045, 2046, 2047, 2049, 2050, 2052, 2054, 2056, 2057, 2060, 2062, 2065, 2066, 2068, 2070, 2071, 2072, 2076, 2080, 2081, 2082, 2086, 2087, 2088, 2090, 2091, 2092, 2093, 2095, 2096, 2098, 2099, 2100, 2101, 2102, 2103",5,"I saw the reflection of a sun on rippling water. Some of the water morphed into a sailboat. The sailboat then began to move across the water.  I saw the screen flickering white, red, and black. Close to 10 minutes I saw zig zag lines at the top of the scree, almost looked like chevron pattern or when the satellite goes out on the tv I saw the screen turn blue, and it seemed to be an ocean, shimmering... I saw the screen turn pink... all around the edges it was scalloped, like a continuous stone design, like I was looking out a scalloped edge window.... at times I saw a figure, silhouetted, standing and turning as though in front of a window, three times I saw the figure I think.... then the ocean again, but this time through a round opening like a portal... and yellow... yellow and blue. Once I saw a boat, an old fashioned sailing boat but indistinct like it was made of clouds. I saw the shape of a man coming out toward me from the center of the screen with a forceful motion with his hand I saw the shapes of the figures, like filmed skyscrapers from a drone, an attraction like a Ferris wheel, but horizontal I saw the sun reflection. It was a clear day, but I couldn't look at the sky, I only saw a reflection. Before, color explosions and transitions in different rhythms I saw the that I was watching the road inside the car and trees, the road, etc. were getting further from me. There was a house and I was walking through he door and when I touch the door handle it disappeared.    I saw the travel through space, my view obstructed by the red flashing but behind that I could see stars that were slowly turing. The scene kept shifting sometimes to shapes and colors, sometimes to cartoonish faces of people and figures. They were standing on a road and lokoing to me through my screen (again the red flicker was obstructing the view). Then I saw movements and the scene accelerated and moved back to the stars I saw the visual distortions first before the complex objects and environments and then the even more vivid and complex as well as seemingly sentient and attempting to communicate a message of some kind to me imagery I described above in the 'other' category emerged. I was captivated, however, unfortunately I had to finish early because I experience extreme migraines and the intensity of the imagery shifting was starting to feel like a migraine  'aura' or as if the it was causing painful eye strain that could trigger a migraine for me.   I saw threads in blue and pink. It can also be called a line. These lines were side by side. They were spinning fast together. They usually circled or followed a path similar to an infinity sign or the letter S. Sometimes they would come out from under the phone like a plant blooming. I saw three dimensional discs which resembled 'galaxies' spinning in various directions with beams of light coming out. I saw three distinct images;  Two wide black horizontal lines at top and bottom and multiple (3+) thinner black horizontal lines oscillating in the middle.  But if I concentrated on the very center of the screen, then 20 or so thin black vertical lines oscillated/flashed with the horizontal lines becoming dimmer but not disappearing.  If I concentrated on the righthand side of the screen, then I saw a long hallway, like you'd walk down in a school with huge windows along the lefthand side, and brilliant sunlight streaming in onto a super shiny waxed floor, windows into classrooms along the righthand side and a big window at the end of the hallway.  The hallway was probably 10 ft across and 60 feet long.  That image would disappear if I looked back toward the center but would reappear if I looked right back. I saw trains driving on the road coming out of tunnels, and the road had loops that they would drive on and go upside down--and the road was in a city; I saw patterns of boxes/checkered patterns I saw trees, a castle, and a helmet with wings I saw triangles, it looked like the vault of glass, then it went to space, black holes eating stars, and quasars spinning and pulsing, spinning disks. It also looked like I was racing or going very fast and the tack was moving, I could see different perspectives if I looked at the top bottom or center of the screen.  I saw tunnels as I ran down them; spinning ferris wheels with red white and blue lights moving across the screen; simple shapes such as circles and squares flashing and moving; more complex shapes like spiderwebs, funnels, and complex line patterns dancing and spinning and turning around on the screen. I saw tunnels that I travelled down as they twisted and turned. I saw vortex shapes like spinning hurricanes. I saw geometric spinning shapes such as hexagons. I saw shifting chequer board shapes. Later toward the end I started to see something stranger. It's like the computer screen ( outside of the screen ) had fuzzy snow like noise that streamed outward. You know like when you are viewing a 3d tv imagine? It's difficult to explain. I saw two distinct images. First, it was like I was watching a chrome hubcap rotating along with a car tire. That lasted a few seconds. Later I saw a line of can-can dancers, with frilled black dresses, thin white waists, and their arms were above their heads, crossed at the wrists. I saw two ribbons interlocking and flowing upwards into a double helix. My mind wandered and I was picturing the space around myself, and the darkened room. Then I closed my eyes and saw incredibly vivid diffraction patterns. I saw various images in the center of the screen and at times all over the screen. I saw waves, a box come out and recede, it looked like a swastika at one point, blue and green bars. I saw webs of colour yellow like vegetation and green spot patterns I saw what looked like etchings of light, and blue dots, moving all around the page I saw what looked like oblique linear bars at right angles to one another towards the lower half of the screen up to the centre. I saw what resembled the shape of an eye/iris in the center of the screen, as well as lines radiating outward from the eye, like rays of sun. I saw white diagonal lines flashing in the center of my vision, almost forming a V shape. I saw Xs seemed to be made up of the beam of light, persisted for a few seconds then began to change colours, started from light red, to white, to light yellow. The middle part of the X looked pretty lighter than the periphery, which looked maroon to black. The Xs were occluded by an infinity sign which exhibited similar colouring pattern with the Xs and increased in size as for a few seconds then went back to the initial size, then repeated. I also saw waves of a beam of light moving from the left of the screen to the right(from my right to the left), these waves demonstrated similar colouring patterns as the aforementioned figures. I saw yellow bars around the edges. I also saw shapes moving and shifting, although I could never quite make out what they were. I saw yellow lines zig-zagging across the screen. Couple of dark circles. At certain points of time I felt the flickering between red and black was like somebody had zoomed in on a bouncing out-of-focus basketball and I could sort of see the curvature of the ball as the screen turned red. At other points in time I felt the flickering is like when two trains pass next to each other and I'm in one of them in the window seat.  I saw yellow, then purple, throughout, kind of speckled through (could be afterimages from the red). Maybe 2/3 of the way through the screen started to get larger and then shrink back and forth. Sometimes the movements seemed to take on a whirlpool shape. I was in a room with no lights on, but daylight filled the room. I say a funny face, I saw many wheels, I saw a laser point that roam on the screen, I saw lady bird. I saw many other colors I see blue colour and green sometimes i see lines and a shape just like inside of a tube I see lines, geometric shapes and shining point. Blue, yellow and orange sometimes green. I see the Pink colour. İt is every where and ı don't care. There is not pattern or design.  I seemed to have some control.  For example, I could start things turning clockwise, or counter-clockwise. I seen a eye ball like it was soulless, a white dot appeared in the center of the retina, in the white noise i heard faint music and voices. It seemed like i dozed off and woke in seconds and seen a list like you'd see on Microsoft but gone to quick before i could read it, seen a building towards the right of screen. What got me is the voices and the music i heard in the white noise  I seen way too many things. The white noise enhanced alot to the point of like seeing in a movie when someone's life is flashing before their eyes just before they pass away. That's almost exactly how it was for me. Not only did I see images of different things such as the heartbeat lines moving across the screen, a pulsating heart shape, the swirrles as if I had dipped my finger in water to create that pattern but it was meant to stand for the Ripple Effect but I also seen images of suddenly my childhood flashing on the screen I could see two people coming together as if they were putting their forheads together and fixing to kiss. I also seen different slash marksas if with my fingersI had scratched the screen on the left and right sides that would flash through the entire experience. This experiment in a sense made me berry emotional perhaps because maybe I was already kind of sad prior to the experiment I'm not real sure but it definitely made me emotional. All in all this was an amazing experience but it did create the feeling as well as images to go along with it as if I had watched my entire life flash before my eyes. Each heartheartbeat line that had beat across the screen began from the bottom left corner and only showed about two top beats then would go away and then flash across the screenagain in the center and then on the right of the screen the Ripple effect images stayed on the bottom cemter to the bottom right corner, the heart shape that pulsated would flash from the center to the right of the screen but turned slightly to the left as if it were angled I shifted locations multiple times, one was a forest floor looking up seeing rain falling, another was in a checker board kind of room that spiraled into infinity. I saw three human figures holding hand dancing in a circle. I also saw lines that moved across the screen that reminded me of a physical representation of the internet, or the book case scene from Interstellar.  I stared at the center the whole time as best possible. I saw very vague starburst like shapes appear from center alternating from yellowing orange to blacky-red. Very much similar to the after image (solarised shimmery blobs) you get staring at something bright then dark e.g. a light bulb filament. On very few occasions I saw very vague lines or patterns in these colours that seemed to be more related to moving my eyes and refocusing around my screen. I definitely saw more deeper visuals when my eyes got heavy and I realised they were closing and I was more 'daydreaming' than seeing actual visuals. If I had to guess, I would say that because this would only trigger red cones while the red screen displayed (red saturation), and the other rods/cones activated either by the visuals created by the red cones after images or by desaturating the visual field of red (dim spectrum of all colours). It is probably just an optical illusion created by triggering different rods/cones in the eyes at different rates.  i started off in a house with a bunch of mayhem. 
carts are scratching the couch while dogs are barking. lamps getting knocked over.
yellow walls. chandeliers going back and forth. then the blades and saws stuff. 
an X that rotated when my head rotated. 
 I started off just seeing lines forming where my eyes were focused, forming crosses and starts that morphed between each other with the flickers. The space in the middle sometimes looked like an eye, sometimes like a person's face, sometimes like a smiling mouth. I also began to see flashes of bright neon yellow-green forming lightning bolts. At one point I moved a tiny bit and the change in the angle of the screen struck my eyes immediately and formed what looked like a forest or a city on a hill. The more complex images didn't look as detailed as in my imagination typically, but they seemed more vivid and my imagination filled in the gaps. I started out by seeing an x pattern. That was reminiscent of the death star trench run, where the x wings were shooting lasers. Larger close by, but then fading and becoming more acute where they converge.

I saw a Spinning wheel that looked like a buzz saw. Only the teeth at the end looked like cartoon lightning bolts closing at a point, probably about 32 teeth in total. The wheel was gray/black, and split into two wheels. Both continuously spinning.

After this, I would notice and up/down motion like water smashing down. Majority in the peryphery but if it was simplyer it could pass moving or just be there in the center I started to see ""cartoonlike"" lines of organic shapes merging into each other, and often a swirl at the center and a feeling of travelling fast  I stopped because it became boring. My best description is that there was a pale white or light yellow 'spider web' effect over, or within, a background field of slightly darker orange-ish yellow. i swa shapes and something like a butterfly and atoms like structures I tended to see images like our known universe; complex structures like Einstein Rose bridges, starships and alien beings not too dissimilar to humans, yet animal in varying degrees. I think everything or at least most of what I saw was cartoon-ish/looked like it came from a 2-D videogame. I saw a lot of trees and a lot of gears. Color-scheme was very monochromatic/red (anywhere from almost black maroon to pinkish white), but there was quite a bit of orange, yellow, and blue as well as some green and purple too. Most of what I saw was moving very quickly, for instance, a line of trees (cartoon trees) along the bottom of my screen would stretch tall and then zoom all over the screen (usually in a line) before turning into something else, or before disappearing under the metaphorical shadow of something completely new taking their place...for instance, the entire screen turning into spinning gears, kind of like one of those optical illusions (except its actually spinning). If I used any mental energy whatsoever other than ""I'm going to watch these gears spin until they morph into the towering sky scrapers that pop out of comic books and then trees rushing around the screen like bullet trains"", then I could see something a little more specific and *mildly* less chaotic, like a car treading up the steps of a pyramid or a cartoon monkey building a boat. I tried to not think too hard though, and just watch the screen like a movie that I'm not really trying to put any mental effort into understanding, so things like the pyramid car and monkey boat weren't the majority of the experience and didn't last very long. ı think ı saw an A I think I saw green flashing as a color on the whole screen throughout. No other imagery I think maybe I'm a bad test subject :) The flashing evoked images only in my head. The light stayed the same except becoming more similar to sunlight through leaves or bridge struts. It was interesting! I thought there were some geometric forms emerging.   I travelled back in time. I saw Tudor roses, Tudor hall walls, Tudor battles; then down a tunnel to William the Conqueror and the Battle of Hastings -- I saw horses bashing into each other, pikes and spears thrashing around. I was associated -- sitting on one of those horses, bashing hard into other horses' chests. I tried this at 12:34AM so this may have impacted my experience, but has definitely impacted my writing, haha. 

I would try this out at an earlier time but between how long this description already is and how getting a similarly-lengthed session at such a time in my current situation may be difficult due to noise, this will have to do. Sorry.

DESCRIPTION:

Throughout a lot of what I saw the simple red/black imagery acted like a veil of varying transparency

The first images I saw were pretty vivid. The very first of these I saw was a carousel of faces from a top-down perspective. They soon dispersed and I began seeing in black and white, with the first thing I witnessed being what looked like simple drawings floating upwards before a transition to furniture - like desks and tables - doing the same thing.

Note that for the majority of what I witnessed, it would continue to have this sort of monochrome black/white perspective. It was grainy like an old film or certain imaging technology like night vision, but in a way that you can probably see in some artistic styles, where the black and white were used to either indicate light or to highlight certain parts of a shape/figure/etc, etc.

After this I had a perspective of someone standing at one end of a rope bridge and I watched a black figure running across it, getting smaller as they gained distance from my point of view towards the base of a massive cylindrical object made of concrete(?).

Afterwards, I had a person sending forth some kind of beam of light that pierced the clouds above them, which then transitions to the next description.
I'd then get spotlights on various things for a while, but there was never enough white on the objects despite the light to make any of it out. Soon I had a perspective of the source of the spotlight though and it was just being emitted out of thin air. A person fell a great distance yet was not harmed nor bothered because they immediately began to run. Unfortunately for them though there was some kind of fleshy (the pink and the yellowy-white included here), sinewy monster that took to housing itself in this weird book/chest with sharp teeth (e.g canines from a carnivore) sticking out of it, much like a hermit crab. It was either bipedal (but with its spidery legs resting like a crab's, instead of it standing tall) or ""tripedal"" .Its legs were long and seemed impossibly thin (kind of like a spider's) for what it likely weighed, yet it lurched itself forward pretty fast and gave chase to the fallen person as they turned away and entered a full sprint. The creature was about to catch up but the person had just gone through a detached doorway leading somewhere else. Instead of giving up though, it fired a continuous laser through the open doorway and with that my first lot of complex images ended. 

I can't really remember a lot past this, though I did once have a perspective of flying through a void and zooming past what could've been a beautiful, stout vase-like piece of pottery. It was white and blue like fine china, except I saw the upper section of it to have maybe had enamel painted on it in tiny diamond shapes to give it texture, rather than being smooth.

Doing it for extended periods of time seemed to reduce the frequency and how often images would be notably vivid for me. This may just coincide with me growing increasingly tired, however.

 Trying out music would take away my focus from more complex imagery. During this time though I did repeatedly, very vividly and clearly envision a simplified big-round-headed humanoid figure that glowed with white and was riddled with moving horizontal, rectangular black shapes. It did a few things but I don't really remember what. I think I once saw it pluck a flower and try to give it to some obscured entity. Any attempts for me to focus it into a more accurate human shape would only last for a second at most before the images would momentarily stop, before returning to the figure doing something. Sometimes when attempting this manipulation it would just stretch out in one direction infinitely. Not disturbingly, but more in that odd, sometimes goofy way when something goes wrong with a digital 3D model.

None of the simple images inbetween the many scenes were really remarkable and remained as black/red only, but my mind would frequently show a lot of spinning patterns and also frequently turned them into 3D objects to rotate clockwise whilst it would continue spinning and it seemed to do this with a surprising amount of accuracy and consistency. Obviously this is subjective and other simultaneous patterns could've obfuscated anything weird but I still believe it to be noteworthy.

EXTRA OBSERVATIONS:

Observing the Ganzflicker with one eye would show intense perceptions of simple imagery with occasional transitions to something more complex. Either eye saw something significantly different, one sometimes more clear than the other. There would be changes in the geometry like how 'dense' the patterns were packed into the same area as the other, how blurry it was, what shapes made up the same pattern. Stuff like that. However the imagery was marginally less clear overall and would only stay as red/black. One time this led to me being within some kind of ring with a groove on the inside and the perspective was just of something continuously going along said groove at a high speed. 
After this when using both eyes I would envision a lot more tunnels, including a rail tunnel at one point that led to a bridge with a view of a ruined cityscape. A rotating perspective around a train that materialised out of nowhere gave me a decent view and buildings were crumbled and on fire (one part of the city was just a pile of large granules). This was also the only definite complex landscape I would witness, however it was not very clear.

Closing my eyes during the Ganzflicker also would produce new patterns. I don't really have the words to describe them but during one attempt they swirled like they were fine grains in a fluid I disturbed and from then on in that attempt I had a constant 'vision effect' of being underwater or looking at water being swirled or otherwise disturbed.

Coming back after writing all of the above and doing a quick observation was interesting too. I saw four sets of whatever you call those sets of wheels you get in a combination lock, in some kind of intricate device. Each were of identical length, probably 16 wheels long each. Some were scrolling rapidly, most being in the middle but a few towards the ends away from the centre of the screen also scrolled. They had numbers but also alphabetical characters on them. Returning my attention to the centre gave way to a growing white background with gibberish printed in text across it. The background consisted of straight lines and resembled an upside down T-shape. I viewed for roughly 3.5 minutes without blinking. I saw random flags and I at one point saw 2 presidents dancing in checkered patterned. A lot of distortion I was holding it close to my face. For roughly 5 seconds I looked at the TV and it was in black and white I vividly saw a submarine breaching, the number 7, and Xs. Also if i looked at the center of the screen it appeared as if the colors were moving away from the center and if i looked at the top or bottom it appeared as if they were moving towards the center I vividly saw blue flickers at brief points throughout the experience. I saw a thick curved outline of a complex shape that persisted for a few seconds before fading, like a thick black line with a few curves in it. I also saw a circle flash for barely a second. I was able to create complex shapes on the screen by gently following their natural progression. Usually symmetric and moving in a direction of my attention. I was able to visualize whatever I chose after a couple minutes into the experience. wow. I want one. I was aware of my thoughts and emotions and imagination, but nothing visually appearing on the screen, in a form of hallucination. I was disappointed. I was hoping since I can visualize entire movie like scenes complete with sound in my head that I'd see more than a flashing black and red  screen. Some yellow around the edge and some shapes but that was it. I was driving down a winding road when a bright red bean came at me. Then I saw a blackhole in the distance and it was sucking the red beam into it. Then I saw blast of shapes, starbursts, geometric shapes, it became objects like an ear, tongue, mouth wide open as if to bite into a large sandwich. Then the shapes again, and lots of starbursts. The last thing I remember is seeing a figure looking straight at me then turn to it's right, then vanish and the shapes came back. It was time to stop. 10 to 12 mins I was floating through space, seeing what looked like planets and suns, with long streaks of light as well. I was flying on the ocean then I dived and saw six eyed creature under me I was flying through a square tunnel, I saw two Chinese dragons chasing each other in an infinity loop, I saw a black orb inch-working across the screen, I saw a dancing ball of light, I saw a galaxy far off in the distance behind a web of thin red lines, I saw cubes flying in and out of the screen. Various geometric shapes that tended to spin around the center of the screen. I was going down a box shaped tunnel, twisting and turning as faces and animals appeared in front of me, as if I were running into them as I descended down the twists and turns. It made me anxious and nauseated & I couldn’t complete the 10 minutes. I was in the ocean floating on my back, looking at the night sky. I could dive under, or fly up, almost into space. I controled it. I was lulled into a sleepy state. It made me wanna really sleep. I struggled to keep awake. Once I had the auditory hallucination as if the white noise was making my thoughts beat somehow. ı was see my ex girlfriend ı with her in istanbul and we are leave in there and we are still love each other I was strangely connected to the screen and each time the speed of the video and the shapes it created were changing. I was taking a train trip somewhere there were many people on train, I was in jungle with tigers not frightening just vividly alive I was thinking about memories that I could make with my friends in the future. We went to the top of Mount Fuji and watched the sunrise. Then the scene shifted to the left to the sun and in the bottom right I saw the figure of the Eygptian God Ra or maybe Horus. I don't know it was the guy with the bird head. He was on the bottom right holding like a spear thing. He pointed it at the Sun. Then the 10 min white noise stopped and it went away. I watched faces, like a face that is on the other side of the screen, I remember seeing a jungle and the sea I watched for 20-30 sec,and immediately was disquieted by an emotional affect (i don't want  want to say anything cheesy, but i was felt like it was something I've never experienced  - excitement, unease, totally uncolored by 'conscious thought.'  I have a strong internal monologue.  Every sentence I externatize (write, type, say, sing) is absolutely dwarfed by the internal composition that was always been ""me""   -When the colors began turning into shapes, that turned into textures, gave away to ""structure"", i had no thoughts.  Im sure you're familiar with charles bonnet syndrome/hallucinations.  They would be ""experienced"" in the visual cortex, or there adjacent.  In this experience, I felt at absolute ""shift"" in awareness, concentration, consciousness  that was not angst-inducing, but I had to step out, to learn more about the project.  It was definitely a first for me - a first one of ""these"" I would see bars across the screen of the opposite color being shown. I also would see green between the red and black. I wasn't sure if either thing was a hallucination or was a display artifact of the screen that I viewed it on. I would see occasional flashes of shapeless green light intermittently initially, but after a while they disappeared. I’ve seen shapes then became a red and blue flag moving, then a blue river  Idk if I closed one eye (either left or right) it was like running through the stone wall maze. Wall on the left hand side of such tunnel/maze had very regular hexagonal tiles, wall on the RHS had stones of various shapes and sizes.
Looking with both eyes pictures changed over time, but it was an image of repeating pattern over large areas of the screen. Some of the patterns resembled:
- pineapple skin, or pine apple leaves,
- fish scales, 
- fireworks
- flowers growing out of the screen towards me If I could use one word to describe my experience it would be ""rotational."" Everything I saw rotated, and it was very dizzying. Sometimes I would see multiple points where these big fan blade like objects were spiraling around. Sometimes the fan-blade like objects would spiral into these points and get smaller and smaller until they disappeared. Sometimes everything felt so chaotic and impossible to interpret. There were lines and shapes spinning in my field of view, a translucent sphere of spirals containing another sphere of spirals and so on. Briefly, I saw circled that looked like they had a six-pointed star inside. The whole thing was very disorienting. When I closed my eyes it was like I hit a reset button. The visuals start with blocky, checker-board like patterns that start to rotate around a common point. Then, other points will emerge and morph. I never saw anything that actually made since as an object, only geometry. If I focused, I could see the colors change faster or slower, and instead of immediately changing they would seem to transition (like transitions from one slide to the next in Power Point).  Iı Iikk Illegible wording at first which I couldn’t bring into focus, a large X then moving lines I'm not know I'm not sure where to begin nor if the Ganzflicker was driving what I saw or if my mind was driving what I saw, regardless of the Ganzflicker, as my mind's eye constantly plays in the background of my mind anyway. Sometimes I can focus on what is being projected and bring it to such minute detail that it is as real as physical reality but it is fleeting, no more than a second or two for each scene such that it is hard to describe what I was seeing from memory. Most often, what I see is typed documents written in a language I do not understand, although in the english alphabet, sometimes a word at a time, a line, a paragraph, or even entire documents. It is formatted and looks like I am seeing a newspaper. I have tried to force my mind's eye to translate what I see but doing so tends to defocus what I am seeing. I get the feeling that it is possible to translate but my mind does not generate enough energy to do so.

Like my mind's eye, my thoughts don't stay focused long either. They bounce around quickly from one thought to another, sometimes connected to the previous thought but more often than not, irrespective of the previous thought. It's like seeing random Wikipedia pages. İmage going left to right. Moving in a worm. White. a ball with mixture of black and red. Images flashing in different parts of the screen. Sometimes in only outlines then flashing in solid black images in grayscale with red acting as the black. started as animal like faces staying for a while then shifting into a new face and then turned into flowing corridors and tunnels of texture and patterns almost like in a linear path video game. images of cats walking across the screen as if the computer was a window; biplanes and men manning them going in circles and performing aerial acrobatics, supernovas and galaxies of light spinning and rotating around their own axis of gravity; a quilted plaid pattern repeating over the screen, etc... Images of geometric patterns, shapes, plants, and birds morphing into views of buildings and landscapes with plenty of movement.  Images seemed to center on my visual focal point. Where I was looking at the time.  Images tended to start in the center, but could expand to the periphery or move around the screen. Images typically were geometric in nature, and often resembled a 6-spoked pattern. Symmetry was common, and often there was an element of rotation (either the image itself rotated, or there was a spiral pattern such as a double-helix centered in the middle of the screen). The spokes or spirals often had a stripped pattern to them. Towards the end, the patterns often resembled a six-legged starfish or jellyfish creature that seemed to ""swim"" across the screen. Images were sporadic and tended to be when the screen flashed black. The first shapes to form were a contracting square with rounded corners that formed about half way through the sides of the screen and moved towards the center of the screen in a repeating flashing motion. This then built to multiple simultaneous shapes at the same time. Flashes later developed into v shapes that spread across the screen, partly overlapping each other as they pulsed and flashed and migrating upwards. Most of my imagery was to some form similar to that. Imagine being at the bottom of a train looking at the train tracks head on, close up from a top view and that the tracks themselves are black and the earth that lies beneath it red immediate dread, saw a crucifix which seemed to mold shape and begin to rotate. After a while I had the sense of rushing water, which seemed to sort of meld into the suggestion of eyes. After a while it was hard to focus, at which point it looked like the flicker became red, blue, purple and white, and I was no longer seeing any clear shapes. Toward the end, bright, curving white lines appeared on screen, moving in long arcs like sedate worms, and shortly thereafter, geometric shapes which had a fractal quality and seemed to shrink towards infinity at the center of my vision; these shapes alternated between circles (which was the most prominent), triangles, and squares (the least prominent). The longer I watched, the more complex the visuals became, although throughout the experience, there were brief flashes of more sophisticated hallucinations, particularly eyes, teeth, and wounds like gashes. These became more frequent as I went on. Often times these more complex hallucinations were mixed in strange ways, as though collaged in a sort of cubistic style: sometimes literally, as though viewed through a prism; and sometimes metaphorically, as though a broken bit of white, sharp teeth occupied a part of the screen while a wide open eye stared at me from another. The latter evoked a sort of broken, predatory, animal face, with a deeply unsettling monstrous quality.  Immediately I began seeing complex geometric patterns. These were not simple elementary school shapes. They formed warping tessellations, they were both two- and three-dimensional, and they were moving exceedingly fast. These patterns often formed whirlpools that could spin in either direction. Eventually I began to get glimpses of more vivid images, such as tree lines, a sea of clouds viewed from above, a distant castle, a skyline, a nice park scene, and once, a Jupiter-like planet with a far more artistic surface. Frustratingly, however, these images were so fleeting as to be nearly unnoticeable, and only appeared in the black screen. About halfway through at best estimate, there was a noticeable change in what I saw. The geometric patterns became blurry, as if I had zoomed in on them, and seemed more like lighting effects flashing across the screen. Gone were the sharp tessellations and I could not bring them back. I could no longer see scenery, except for a tree-lined river towards the very end. Instead, I saw faces, some blurry, some sharp in detail. Interestingly, I only saw faces in the red screen, as if the color of the Ganzflicker determined what I saw. The faces only appeared for a split second compared to the earlier images, yet seemed easier to perceive. I could hold on to images in the black for a few or several flickers before they faded. The faces, on the other hand seemed to only appear in one flicker. Whereas most of the black images appeared to be the same size, the faces could be any size and seemed to appear in a far greater variety of locations on the screen. There was no correlation between how big the faces were and how blurry they were. Most of them did not appear to be any face I'd seen before. A few were recognizable types of people, such as a nun or a fancy looking man. A further few could have been people I'd seen before. Most of these looked like painted portraits of scientists and 18th century historical figures. I could even imagine them wearing colored business suits of the period, though I didn't actually see such colors. The red varied in lightness, almost to the point of white-pink. The black was much less varied, but occasionally gray or even white tines appeared. That is the extent of colors that I saw. Immediately I saw a pattern of circular red shapes with the extra space being filled in with brown/black. 

Throughout the experience shapes would very suddenly dissipate and disappear and bright red lines would sometimes work their way down from the corners of the screen and meet in the middle. Immediately I saw colors of all kinds and it felt as if the screen was breathing. I found myself very interested in how the edges of the screen would turn white and move inward towards the center of the screen and imitated a sort of breathing motion. At one point I saw a ball of light and I imagined that it was on the end of a sort of magic wand and it moved all over the screen with no pattern whatsoever. I felt as though I was supposed to stay with it and train my eyes on the ball of light, following it as best I could. The ball of light was white with blue emanating from it almost like a shooting star or something you would see in space. I also felt a presence, almost like an energy in the flashing screen and it became quite comforting. I did feel myself wishing I had seen more and more clearly but most of what I did see felt abstract, including the shifting colors, shapes and then energies of the screen flashing. Throughout the experience, I had the sense that I was watching a story unfold, even though I had no context for said story. That is just what I felt."
